<?xml version ="1.0" encoding="UTF-8"?>
<!DOCTYPE RULESET SYSTEM "rulefile.dtd"> 
<RULESET ID="1">
  <!-- global part is the default for all rules -->
  <!-- overwritten by rule specific configuration -->
  <GLOBAL>
    <!-- how long the rules are active -->
    <PREF NAME="Duration">1000</PREF>

    <!-- export time interval -->
    <PREF NAME="Interval">1</PREF>
  </GLOBAL>
  <RULE ID="1">
    <!-- match all packets -->
    <FILTER NAME="SrcIP">*</FILTER>

    <ACTION NAME="capture">
    </ACTION>
 
    <!-- export tcpdump file, can be read with
         tcpdump -r -->
    <EXPORT NAME="bin_file">
      <PREF NAME="Filename">capture</PREF>
    </EXPORT>
  </RULE>
</RULESET>
